id,name,email,resume,education,summary,experience_years
cand_001,Raj Kumar,raj.kumar@email.com,"Senior Backend Engineer with 8 years of experience building robust Python applications. Proficient in Django, FastAPI, PostgreSQL, and AWS. Led a team of 5 developers in scaling our e-commerce platform. Experienced with Docker, Kubernetes, and CI/CD pipelines. Strong in system design and have mentored 3 junior developers. Certified AWS Solutions Architect. Experience with TensorFlow for recommendation systems.",B.Tech CSE from IIT Delhi,Backend architecture specialist with focus on scalability,8
cand_002,Priya Sharma,priya.sharma@email.com,"Full Stack Developer with 4 years of experience. Strong in React, Node.js, Express, and MongoDB. Built multiple production applications using modern JavaScript. Familiar with Docker and basic DevOps. Good problem-solving skills and quick learner. Worked in startup environment with agile methodology.",B.Tech CSE from DTU,Full stack developer passionate about clean code,4
cand_003,Arjun Singh,arjun.singh@email.com,"Data Scientist with 6 years of experience in machine learning and analytics. Strong Python programmer with expertise in scikit-learn, TensorFlow, and Pandas. Built predictive models for customer churn and recommendation systems. SQL expert with experience in large-scale data analysis. Created dashboards using Tableau. Published research papers on deep learning. Cloud experience with AWS.",M.Tech from BITS Pilani,ML specialist focused on business impact,6
cand_004,Ananya Desai,ananya.desai@email.com,"Junior Python Developer with 2 years of experience. Solid foundation in Python programming. Recently completed Django and Flask courses. Know basics of SQL and PostgreSQL. Familiar with Git and GitHub. Participated in several hackathons. Eager to learn and grow in backend development.",B.Tech CSE from NMIT,Passionate junior developer keen to learn,2
cand_005,Vikram Patel,vikram.patel@email.com,"DevOps and Infrastructure Engineer with 5 years of experience. Expert in Kubernetes orchestration and Docker containerization. Proficient with AWS, Terraform, and CloudFormation. Implemented CI/CD pipelines using Jenkins and GitLab CI. Experience with Prometheus monitoring and ELK stack. Automated infrastructure provisioning reducing deployment time by 70%. Linux server administration specialist.",B.E. from NIT Trichy,Infrastructure automation enthusiast,5
cand_006,Neha Gupta,neha.gupta@email.com,"Full Stack Developer with 5 years of experience. Proficient in React, Vue.js, Node.js, and Python. Strong in database design with both SQL and NoSQL. Implemented microservices architecture using Docker and Kubernetes. CI/CD experience with Jenkins and GitHub Actions. Led mentoring sessions for junior developers. Certified in AWS.",B.Tech CSE from IIIT Hyderabad,Full stack developer with DevOps knowledge,5
cand_007,Rohit Verma,rohit.verma@email.com,"Data Analyst with 3 years of experience. Skilled in Python, SQL, Excel, and Tableau. Created business intelligence dashboards for stakeholder reports. Experience with Google Analytics and basic machine learning concepts. Familiar with Power BI. Good communication skills and have presented insights to C-level executives.",B.Com from Delhi University,Data analyst with business acumen,3
cand_008,Sanjay Rao,sanjay.rao@email.com,"Backend Developer with 6 years of experience. Expert in Java and Python. Proficient in Spring Boot, Django, and microservices. Experience with SQL and NoSQL databases. Worked on large-scale distributed systems. Basic Kubernetes knowledge. Published 2 technical blogs on system design.",B.Tech CSE from VIT University,Backend specialist in distributed systems,6
